{"schema":"dinhot.trace/v1","case_id":"FX01_fixture","grid":{"n_pix":64,"pad":2,"bin_um":10.3906,"half_field_um":665.0},"traps":[{"id":0,"x_um":-10.3906,"y_um":0.0,"z_um":0.0,"weight":1.0,"charge":0},{"id":1,"x_um":0.0,"y_um":0.0,"z_um":0.0,"weight":1.0,"charge":0},{"id":2,"x_um":10.3906,"y_um":0.0,"z_um":0.0,"weight":1.0,"charge":0}],"shape":null,"methods":{"M02":{"history":[{"iteration":0,"efficiency":0.41,"uniformity":0.52,"rel_std_pct":27.5},{"iteration":15,"efficiency":0.58,"uniformity":0.66,"rel_std_pct":17.0},{"iteration":30,"efficiency":0.62,"uniformity":0.71,"rel_std_pct":14.2}],"final":{"efficiency":0.62,"uniformity":0.71,"rel_std_pct":14.2,"zero_order":0.02,"ghost":0.05},"trap_intensity":[0.929,1.142,0.929]},"M04":{"history":[{"iteration":0,"efficiency":0.41,"uniformity":0.52,"rel_std_pct":27.5},{"iteration":15,"efficiency":0.8,"uniformity":0.9,"rel_std_pct":6.0},{"iteration":30,"efficiency":0.84,"uniformity":0.93,"rel_std_pct":4.1}],"final":{"efficiency":0.84,"uniformity":0.93,"rel_std_pct":4.1,"zero_order":0.01,"ghost":0.03},"trap_intensity":[0.9795,1.041,0.9795]},"M06":{"history":[{"iteration":0,"efficiency":0.41,"uniformity":0.52,"rel_std_pct":27.5},{"iteration":15,"efficiency":0.74,"uniformity":0.95,"rel_std_pct":3.1},{"iteration":30,"efficiency":0.78,"uniformity":0.97,"rel_std_pct":2.0}],"final":{"efficiency":0.78,"uniformity":0.97,"rel_std_pct":2.0,"zero_order":0.01,"ghost":0.02},"trap_intensity":[0.99,1.02,0.99]}},"reference":{"method":"M04","phase_u8":"AAcOFRwjKjE4P0ZNVFtiaXB3foWMk5qhqK+2vcTL0tng5+71/AMKERgfJi00O0JJUFdeZWxzeoGIj5adpKuyucDHztXc4+rx+P8GDRQbIikwNz5FTFNaYWhvdn2Ei5KZoKeutbzDytHY3+bt9PsCCRAXHiUsMzpBSE9WXWRrcnmAh46VnKOqsbi/xs3U2+Lp8Pf+BQwTGiEoLzY9REtSWWBnbnV8g4qRmJ+mrbS7wsnQ197l7PP6AQgPFh0kKzI5QEdOVVxjanF4f4aNlJuiqbC3vsXM09rh6O/2/QQLEhkgJy41PENKUVhfZm10e4KJkJeepayzusHIz9bd5Ovy+QAHDhUcIyoxOD9GTVRbYmlwd36FjJOaoaivtr3Ey9LZ4Ofu9fwDChEYHyYtNDtCSVBXXmVsc3qBiI+WnaSrsrnAx87V3OPq8fj/Bg0UGyIpMDc+RUxTWmFob3Z9hIuSmaCnrrW8w8rR2N/m7fT7AgkQFx4lLDM6QUhPVl1ka3J5gIeOlZyjqrG4v8bN1Nvi6fD3/gUMExohKC82PURLUllgZ251fIOKkZifpq20u8LJ0Nfe5ezz+gEIDxYdJCsyOUBHTlVcY2pxeH+GjZSboqmwt77FzNPa4ejv9v0ECxIZICcuNTxDSlFYX2ZtdHuCiZCXnqWss7rByM/W3eTr8vkABw4VHCMqMTg/Rk1UW2JpcHd+hYyTmqGor7a9xMvS2eDn7vX8AwoRGB8mLTQ7QklQV15lbHN6gYiPlp2kq7K5wMfO1dzj6vH4/wYNFBsiKTA3PkVMU1phaG92fYSLkpmgp661vMPK0djf5u30+wIJEBceJSwzOkFIT1ZdZGtyeYCHjpWco6qxuL/GzdTb4unw9/4FDBMaISgvNj1ES1JZYGdudXyDipGYn6attLvCydDX3uXs8/oBCA8WHSQrMjlAR05VXGNqcXh/ho2Um6KpsLe+xczT2uHo7/b9BAsSGSAnLjU8Q0pRWF9mbXR7gomQl56lrLO6wcjP1t3k6/L5AAcOFRwjKjE4P0ZNVFtiaXB3foWMk5qhqK+2vcTL0tng5+71/AMKERgfJi00O0JJUFdeZWxzeoGIj5adpKuyucDHztXc4+rx+P8GDRQbIikwNz5FTFNaYWhvdn2Ei5KZoKeutbzDytHY3+bt9PsCCRAXHiUsMzpBSE9WXWRrcnmAh46VnKOqsbi/xs3U2+Lp8Pf+BQwTGiEoLzY9REtSWWBnbnV8g4qRmJ+mrbS7wsnQ197l7PP6AQgPFh0kKzI5QEdOVVxjanF4f4aNlJuiqbC3vsXM09rh6O/2/QQLEhkgJy41PENKUVhfZm10e4KJkJeepayzusHIz9bd5Ovy+QAHDhUcIyoxOD9GTVRbYmlwd36FjJOaoaivtr3Ey9LZ4Ofu9fwDChEYHyYtNDtCSVBXXmVsc3qBiI+WnaSrsrnAx87V3OPq8fj/Bg0UGyIpMDc+RUxTWmFob3Z9hIuSmaCnrrW8w8rR2N/m7fT7AgkQFx4lLDM6QUhPVl1ka3J5gIeOlZyjqrG4v8bN1Nvi6fD3/gUMExohKC82PURLUllgZ251fIOKkZifpq20u8LJ0Nfe5ezz+gEIDxYdJCsyOUBHTlVcY2pxeH+GjZSboqmwt77FzNPa4ejv9v0ECxIZICcuNTxDSlFYX2ZtdHuCiZCXnqWss7rByM/W3eTr8vkABw4VHCMqMTg/Rk1UW2JpcHd+hYyTmqGor7a9xMvS2eDn7vX8AwoRGB8mLTQ7QklQV15lbHN6gYiPlp2kq7K5wMfO1dzj6vH4/wYNFBsiKTA3PkVMU1phaG92fYSLkpmgp661vMPK0djf5u30+wIJEBceJSwzOkFIT1ZdZGtyeYCHjpWco6qxuL/GzdTb4unw9/4FDBMaISgvNj1ES1JZYGdudXyDipGYn6attLvCydDX3uXs8/oBCA8WHSQrMjlAR05VXGNqcXh/ho2Um6KpsLe+xczT2uHo7/b9BAsSGSAnLjU8Q0pRWF9mbXR7gomQl56lrLO6wcjP1t3k6/L5AAcOFRwjKjE4P0ZNVFtiaXB3foWMk5qhqK+2vcTL0tng5+71/AMKERgfJi00O0JJUFdeZWxzeoGIj5adpKuyucDHztXc4+rx+P8GDRQbIikwNz5FTFNaYWhvdn2Ei5KZoKeutbzDytHY3+bt9PsCCRAXHiUsMzpBSE9WXWRrcnmAh46VnKOqsbi/xs3U2+Lp8Pf+BQwTGiEoLzY9REtSWWBnbnV8g4qRmJ+mrbS7wsnQ197l7PP6AQgPFh0kKzI5QEdOVVxjanF4f4aNlJuiqbC3vsXM09rh6O/2/QQLEhkgJy41PENKUVhfZm10e4KJkJeepayzusHIz9bd5Ovy+QAHDhUcIyoxOD9GTVRbYmlwd36FjJOaoaivtr3Ey9LZ4Ofu9fwDChEYHyYtNDtCSVBXXmVsc3qBiI+WnaSrsrnAx87V3OPq8fj/Bg0UGyIpMDc+RUxTWmFob3Z9hIuSmaCnrrW8w8rR2N/m7fT7AgkQFx4lLDM6QUhPVl1ka3J5gIeOlZyjqrG4v8bN1Nvi6fD3/gUMExohKC82PURLUllgZ251fIOKkZifpq20u8LJ0Nfe5ezz+gEIDxYdJCsyOUBHTlVcY2pxeH+GjZSboqmwt77FzNPa4ejv9v0ECxIZICcuNTxDSlFYX2ZtdHuCiZCXnqWss7rByM/W3eTr8vkABw4VHCMqMTg/Rk1UW2JpcHd+hYyTmqGor7a9xMvS2eDn7vX8AwoRGB8mLTQ7QklQV15lbHN6gYiPlp2kq7K5wMfO1dzj6vH4/wYNFBsiKTA3PkVMU1phaG92fYSLkpmgp661vMPK0djf5u30+wIJEBceJSwzOkFIT1ZdZGtyeYCHjpWco6qxuL/GzdTb4unw9/4FDBMaISgvNj1ES1JZYGdudXyDipGYn6attLvCydDX3uXs8/oBCA8WHSQrMjlAR05VXGNqcXh/ho2Um6KpsLe+xczT2uHo7/b9BAsSGSAnLjU8Q0pRWF9mbXR7gomQl56lrLO6wcjP1t3k6/L5AAcOFRwjKjE4P0ZNVFtiaXB3foWMk5qhqK+2vcTL0tng5+71/AMKERgfJi00O0JJUFdeZWxzeoGIj5adpKuyucDHztXc4+rx+P8GDRQbIikwNz5FTFNaYWhvdn2Ei5KZoKeutbzDytHY3+bt9PsCCRAXHiUsMzpBSE9WXWRrcnmAh46VnKOqsbi/xs3U2+Lp8Pf+BQwTGiEoLzY9REtSWWBnbnV8g4qRmJ+mrbS7wsnQ197l7PP6AQgPFh0kKzI5QEdOVVxjanF4f4aNlJuiqbC3vsXM09rh6O/2/QQLEhkgJy41PENKUVhfZm10e4KJkJeepayzusHIz9bd5Ovy+QAHDhUcIyoxOD9GTVRbYmlwd36FjJOaoaivtr3Ey9LZ4Ofu9fwDChEYHyYtNDtCSVBXXmVsc3qBiI+WnaSrsrnAx87V3OPq8fj/Bg0UGyIpMDc+RUxTWmFob3Z9hIuSmaCnrrW8w8rR2N/m7fT7AgkQFx4lLDM6QUhPVl1ka3J5gIeOlZyjqrG4v8bN1Nvi6fD3/gUMExohKC82PURLUllgZ251fIOKkZifpq20u8LJ0Nfe5ezz+gEIDxYdJCsyOUBHTlVcY2pxeH+GjZSboqmwt77FzNPa4ejv9v0ECxIZICcuNTxDSlFYX2ZtdHuCiZCXnqWss7rByM/W3eTr8vkABw4VHCMqMTg/Rk1UW2JpcHd+hYyTmqGor7a9xMvS2eDn7vX8AwoRGB8mLTQ7QklQV15lbHN6gYiPlp2kq7K5wMfO1dzj6vH4/wYNFBsiKTA3PkVMU1phaG92fYSLkpmgp661vMPK0djf5u30+wIJEBceJSwzOkFIT1ZdZGtyeYCHjpWco6qxuL/GzdTb4unw9/4FDBMaISgvNj1ES1JZYGdudXyDipGYn6attLvCydDX3uXs8/oBCA8WHSQrMjlAR05VXGNqcXh/ho2Um6KpsLe+xczT2uHo7/b9BAsSGSAnLjU8Q0pRWF9mbXR7gomQl56lrLO6wcjP1t3k6/L5AAcOFRwjKjE4P0ZNVFtiaXB3foWMk5qhqK+2vcTL0tng5+71/AMKERgfJi00O0JJUFdeZWxzeoGIj5adpKuyucDHztXc4+rx+P8GDRQbIikwNz5FTFNaYWhvdn2Ei5KZoKeutbzDytHY3+bt9PsCCRAXHiUsMzpBSE9WXWRrcnmAh46VnKOqsbi/xs3U2+Lp8Pf+BQwTGiEoLzY9REtSWWBnbnV8g4qRmJ+mrbS7wsnQ197l7PP6AQgPFh0kKzI5QEdOVVxjanF4f4aNlJuiqbC3vsXM09rh6O/2/QQLEhkgJy41PENKUVhfZm10e4KJkJeepayzusHIz9bd5Ovy+QAHDhUcIyoxOD9GTVRbYmlwd36FjJOaoaivtr3Ey9LZ4Ofu9fwDChEYHyYtNDtCSVBXXmVsc3qBiI+WnaSrsrnAx87V3OPq8fj/Bg0UGyIpMDc+RUxTWmFob3Z9hIuSmaCnrrW8w8rR2N/m7fT7AgkQFx4lLDM6QUhPVl1ka3J5gIeOlZyjqrG4v8bN1Nvi6fD3/gUMExohKC82PURLUllgZ251fIOKkZifpq20u8LJ0Nfe5ezz+gEIDxYdJCsyOUBHTlVcY2pxeH+GjZSboqmwt77FzNPa4ejv9v0ECxIZICcuNTxDSlFYX2ZtdHuCiZCXnqWss7rByM/W3eTr8vkABw4VHCMqMTg/Rk1UW2JpcHd+hYyTmqGor7a9xMvS2eDn7vX8AwoRGB8mLTQ7QklQV15lbHN6gYiPlp2kq7K5wMfO1dzj6vH4/wYNFBsiKTA3PkVMU1phaG92fYSLkpmgp661vMPK0djf5u30+wIJEBceJSwzOkFIT1ZdZGtyeYCHjpWco6qxuL/GzdTb4unw9/4FDBMaISgvNj1ES1JZYGdudXyDipGYn6attLvCydDX3uXs8/oBCA8WHSQrMjlAR05VXGNqcXh/ho2Um6KpsLe+xczT2uHo7/b9BAsSGSAnLjU8Q0pRWF9mbXR7gomQl56lrLO6wcjP1t3k6/L5AAcOFRwjKjE4P0ZNVFtiaXB3foWMk5qhqK+2vcTL0tng5+71/AMKERgfJi00O0JJUFdeZWxzeoGIj5adpKuyucDHztXc4+rx+P8GDRQbIikwNz5FTFNaYWhvdn2Ei5KZoKeutbzDytHY3+bt9PsCCRAXHiUsMzpBSE9WXWRrcnmAh46VnKOqsbi/xs3U2+Lp8Pf+BQwTGiEoLzY9REtSWWBnbnV8g4qRmJ+mrbS7wsnQ197l7PP6AQgPFh0kKzI5QEdOVVxjanF4f4aNlJuiqbC3vsXM09rh6O/2/QQLEhkgJy41PENKUVhfZm10e4KJkJeepayzusHIz9bd5Ovy+Q==","focal":{"size":3,"bin_um":10.3906,"db_floor":-40.0,"intensity_db_u8":"tPq0yP/ItPq0"},"axial":null},"feedback":null,"dynamics":null,"rearrangement":null,"summary":{"best_method":"M04","notes":{"en":"M04 reaches the lowest non-uniformity among the methods within half of the best efficiency.","es":"M04 alcanza la menor no uniformidad entre los métodos con al menos la mitad de la mejor eficiencia."}}}